[
  {
    "id": "nursing-patient-sim",
    "title": "Patient Assessment Simulator",
    "description": "An interactive clinical scenario tool that walks nursing students through head-to-toe patient assessments. Students make clinical decisions at branching points and receive immediate feedback on their reasoning.",
    "author": "Dr. Maria Chen",
    "department": "Nursing",
    "discipline": "Nursing",
    "ai_tool": "Claude",
    "format": "Interactive Application",
    "content_type": "Simulation",
    "blooms_level": "Apply",
    "date_submitted": "2026-02-15",
    "live_url": "https://lewis-ai-commons.github.io/nursing-patient-sim",
    "source_url": "https://github.com/lewis-ai-commons/nursing-patient-sim",
    "tags": ["healthcare", "clinical-skills", "branching-scenario", "assessment"],
    "screenshot": "screenshots/nursing-patient-sim.png",
    "status": "published"
  },
  {
    "id": "ai-eval-toolkit",
    "title": "Faculty AI Evaluation Toolkit",
    "description": "A comprehensive recommendation engine that suggests AI tools and pedagogical activities based on discipline, Bloom's taxonomy level, task type, and audience. Features 500+ activities across 33 vetted AI tools with full source provenance.",
    "author": "Jake (Lewis University Library)",
    "department": "Library",
    "discipline": "Interdisciplinary",
    "ai_tool": "Claude",
    "format": "Interactive Application",
    "content_type": "Decision Tool",
    "blooms_level": "Evaluate",
    "date_submitted": "2026-01-10",
    "live_url": "https://lewis-ai-commons.github.io/ai-eval-toolkit",
    "source_url": "https://github.com/lewis-ai-commons/ai-eval-toolkit",
    "tags": ["ai-pedagogy", "faculty-development", "toolkit", "interdisciplinary"],
    "screenshot": "screenshots/ai-eval-toolkit.png",
    "status": "published"
  },
  {
    "id": "ethics-dilemma-engine",
    "title": "Ethical Dilemma Discussion Engine",
    "description": "Presents students with real-world ethical scenarios and facilitates structured moral reasoning using multiple ethical frameworks (utilitarian, deontological, virtue ethics, care ethics). Generates discussion prompts for small group work.",
    "author": "Dr. Sarah Whitfield",
    "department": "Philosophy",
    "discipline": "Humanities",
    "ai_tool": "Claude",
    "format": "Interactive Application",
    "content_type": "Discussion Tool",
    "blooms_level": "Evaluate",
    "date_submitted": "2026-03-01",
    "live_url": "https://lewis-ai-commons.github.io/ethics-dilemma-engine",
    "source_url": "https://github.com/lewis-ai-commons/ethics-dilemma-engine",
    "tags": ["philosophy", "ethics", "discussion", "moral-reasoning"],
    "screenshot": "screenshots/ethics-dilemma-engine.png",
    "status": "published"
  },
  {
    "id": "aviation-wx-decoder",
    "title": "METAR/TAF Weather Decoder",
    "description": "Translates coded aviation weather reports (METARs and TAFs) into plain language with visual annotations. Includes a quiz mode where students decode real-world weather observations for flight planning practice.",
    "author": "Capt. James Rivera",
    "department": "Aviation",
    "discipline": "Aviation & Transportation",
    "ai_tool": "Cursor",
    "format": "Interactive Application",
    "content_type": "Reference Tool",
    "blooms_level": "Apply",
    "date_submitted": "2026-02-28",
    "live_url": "https://lewis-ai-commons.github.io/aviation-wx-decoder",
    "source_url": "https://github.com/lewis-ai-commons/aviation-wx-decoder",
    "tags": ["aviation", "weather", "metar", "flight-planning"],
    "screenshot": "screenshots/aviation-wx-decoder.png",
    "status": "published"
  },
  {
    "id": "bio-labsafety-prompts",
    "title": "Biology Lab Safety Prompt Library",
    "description": "A curated collection of 40+ reusable prompts for generating lab safety scenarios, pre-lab quizzes, and hazard identification exercises using generative AI. Includes instructor notes on how to adapt each prompt for different course levels.",
    "author": "Dr. Kenji Nakamura",
    "department": "Biology",
    "discipline": "Natural Sciences",
    "ai_tool": "Claude",
    "format": "Prompt Library",
    "content_type": "Instructional Resource",
    "blooms_level": "Apply",
    "date_submitted": "2026-03-05",
    "live_url": "https://lewis-ai-commons.github.io/bio-labsafety-prompts",
    "source_url": "https://github.com/lewis-ai-commons/bio-labsafety-prompts",
    "tags": ["biology", "lab-safety", "prompts", "reusable", "scaffolded"],
    "screenshot": "screenshots/bio-labsafety-prompts.png",
    "status": "published"
  },
  {
    "id": "ai-responsible-use-policy",
    "title": "Plain-Language Library Policy for Responsible AI Use",
    "description": "A model institutional policy document for responsible AI use in academic library contexts, covering video creation, content generation, and patron-facing services. Written in accessible language with implementation guidance for library administrators.",
    "author": "Jake (Lewis University Library)",
    "department": "Library",
    "discipline": "Interdisciplinary",
    "ai_tool": "Claude",
    "format": "Policy Document",
    "content_type": "Governance Framework",
    "blooms_level": "Evaluate",
    "date_submitted": "2026-01-20",
    "live_url": "https://lewis-ai-commons.github.io/ai-responsible-use-policy",
    "source_url": "https://github.com/lewis-ai-commons/ai-responsible-use-policy",
    "tags": ["policy", "governance", "responsible-ai", "library-administration"],
    "screenshot": "screenshots/ai-responsible-use-policy.png",
    "status": "published"
  },
  {
    "id": "hcai-writing-workshop",
    "title": "Human-Centered AI Writing Workshop",
    "description": "A three-session lesson plan sequence for first-year composition courses that teaches students to use AI as a collaborative writing partner while maintaining their own voice. Includes session outlines, discussion questions, sample assignments, and a reflective rubric for assessing human-AI co-authored work.",
    "author": "Prof. Andrea Simmons",
    "department": "English",
    "discipline": "Humanities",
    "ai_tool": "ChatGPT",
    "format": "Lesson Plan",
    "content_type": "Instructional Resource",
    "blooms_level": "Create",
    "date_submitted": "2026-02-10",
    "live_url": "https://lewis-ai-commons.github.io/hcai-writing-workshop",
    "source_url": "https://github.com/lewis-ai-commons/hcai-writing-workshop",
    "tags": ["writing", "composition", "hcai", "lesson-plan", "first-year"],
    "screenshot": "screenshots/hcai-writing-workshop.png",
    "status": "published"
  },
  {
    "id": "cj-case-analyzer",
    "title": "Case Law Pattern Analyzer",
    "description": "Presents landmark criminal justice cases and helps students identify legal reasoning patterns, precedent chains, and jurisdictional variations. Includes a comparison mode for analyzing how similar fact patterns produce different outcomes.",
    "author": "Prof. Marcus Webb",
    "department": "Criminal Justice",
    "discipline": "Criminal Justice",
    "ai_tool": "ChatGPT",
    "format": "Interactive Application",
    "content_type": "Analysis Tool",
    "blooms_level": "Analyze",
    "date_submitted": "2026-02-05",
    "live_url": "https://lewis-ai-commons.github.io/cj-case-analyzer",
    "source_url": "https://github.com/lewis-ai-commons/cj-case-analyzer",
    "tags": ["criminal-justice", "case-law", "legal-reasoning", "analysis"],
    "screenshot": "screenshots/cj-case-analyzer.png",
    "status": "published"
  },
  {
    "id": "stats-regression-lab",
    "title": "Regression Analysis Sandbox",
    "description": "A hands-on tool where students upload or generate datasets, fit linear and polynomial regression models, and explore residual plots. Visualizes the impact of outliers and influential points on model fit.",
    "author": "Dr. Lin Zhao",
    "department": "Mathematics",
    "discipline": "Mathematics & Statistics",
    "ai_tool": "Replit",
    "format": "Interactive Application",
    "content_type": "Interactive Lab",
    "blooms_level": "Analyze",
    "date_submitted": "2026-03-10",
    "live_url": "https://lewis-ai-commons.github.io/stats-regression-lab",
    "source_url": "https://github.com/lewis-ai-commons/stats-regression-lab",
    "tags": ["statistics", "regression", "data-visualization", "math"],
    "screenshot": "screenshots/stats-regression-lab.png",
    "status": "published"
  },
  {
    "id": "nursing-ai-assessment-rubric",
    "title": "AI-Assisted Clinical Documentation Rubric",
    "description": "An assessment rubric and faculty guide for evaluating student clinical notes written with AI support. Distinguishes between appropriate AI collaboration (grammar, formatting, terminology lookup) and inappropriate reliance (clinical judgment, patient-specific reasoning). Includes sample scored work and calibration exercises.",
    "author": "Dr. Maria Chen",
    "department": "Nursing",
    "discipline": "Nursing",
    "ai_tool": "Claude",
    "format": "Assessment Rubric",
    "content_type": "Instructional Resource",
    "blooms_level": "Evaluate",
    "date_submitted": "2026-03-12",
    "live_url": "https://lewis-ai-commons.github.io/nursing-ai-assessment-rubric",
    "source_url": "https://github.com/lewis-ai-commons/nursing-ai-assessment-rubric",
    "tags": ["nursing", "rubric", "assessment", "clinical-documentation", "hcai"],
    "screenshot": "screenshots/nursing-ai-assessment-rubric.png",
    "status": "published"
  },
  {
    "id": "explainer-video-ai-workflow",
    "title": "AI-Assisted Explainer Video Production Workflow",
    "description": "A documented workflow and template set for creating short educational explainer videos using AI tools for scriptwriting (Claude), voiceover (ElevenLabs), visuals (Midjourney), and editing assembly. Includes three completed example videos on information literacy topics with full production notes.",